{
  "$schema": "https://json-schema.org/draft/2020-12/schema",
  "title": "KiCad Post-Design Export Plugin Config",
  "type": "object",
  "required": ["paths", "exports", "integrations", "renders"],
  "properties": {
    "paths": {
      "type": "object",
      "required": ["sch_pdf", "step", "manufacturing", "renders"],
      "properties": {
        "sch_pdf": {"type": "string", "minLength": 1},
        "step": {"type": "string", "minLength": 1},
        "manufacturing": {"type": "string", "minLength": 1},
        "renders": {"type": "string", "minLength": 1},
        "visual": {"type": "string", "minLength": 1}
      }
    },
    "exports": {
      "type": "object",
      "properties": {
        "gerber_layer_preset": {
          "type": "string",
          "enum": ["2_layer_default", "4_layer", "6_layer", "8_layer", "all_enabled"]
        },
        "visual": {"type": "boolean"}
      }
    },
    "checks": {
      "type": "object",
      "properties": {
        "erc": {"type": "boolean"},
        "drc": {"type": "boolean"},
        "fail_on": {"type": "string", "enum": ["error", "warning", "never"]}
      }
    },
    "integrations": {"type": "object"},
    "renders": {"type": "object"},
    "strict_relative_paths": {"type": "boolean"}
  }
}
