{
  "paths": {
    "sch_pdf": "doc/schematics",
    "step": "3d",
    "manufacturing": "manufacturing",
    "renders": "renders"
  },
  "exports": {
    "sch_pdf": false,
    "step": false,
    "gerbers": true,
    "gerber_layer_preset": "2_layer_default",
    "drill": false,
    "position": false,
    "bom_collapsed": false,
    "bom_line_by_line": false
  },
  "integrations": {
    "jlcpcb": false,
    "ibom": false
  },
  "renders": {
    "top": false,
    "bottom": false,
    "left": false,
    "right": false,
    "iso1": false,
    "iso2": false,
    "iso1_az": 45,
    "iso1_el": 35,
    "iso2_az": 225,
    "iso2_el": 35,
    "quality": "medium",
    "width": 1920,
    "height": 1080
  },
  "strict_relative_paths": true
}
