{
  "paths": {
    "sch_pdf": "doc/schematics",
    "step": "3d",
    "manufacturing": "manufacturing",
    "renders": "renders",
    "visual": "doc/visual"
  },
  "exports": {
    "sch_pdf": true,
    "step": true,
    "gerbers": true,
    "gerber_layer_preset": "2_layer_default",
    "drill": true,
    "position": true,
    "bom_collapsed": true,
    "bom_line_by_line": true,
    "visual": true
  },
  "checks": {
    "erc": true,
    "drc": true,
    "fail_on": "error"
  },
  "integrations": {
    "jlcpcb": false,
    "ibom": true
  },
  "renders": {
    "top": true,
    "bottom": false,
    "left": false,
    "right": false,
    "iso1": false,
    "iso2": false,
    "quality": "low",
    "width": 640,
    "height": 360
  }
}
